{"schema_version":"metriplane.program-delegation.v1","signature":{"actor_id":"96778fbb-c8ff-42b3-9217-7cac45dcd097","key_id":"55a7ba6d677cc402c3b39a9fe59072d50beedfcaa42084a77d2f80d586675666","provider":"linear","signature":"e5dd6550f4b42629aea4ac5a5d4c71c1d2cb8d1bf9304501fc99ad96ab4e5eeee49cab614e9e5de25be91d5d96e3282ab884d00ed1345c9e732d5e81c3b38e06"},"subject":{"attestor":{"key_id":"04f916b718542f51d18f2315a6a24c9dd7a24b8667c96bc350967d2c38774312","kind":"isolated_provider_attestor","public_key_hex":"ffc106b72d0fb3914d3206ec89c7e370403de610f129171608a336adb8e19fff","service":"metriplane-health"},"delegate":{"executor_id":"01a096e0-4e21-7a11-9f0f-fb303387c5c0","key_id":"8144302ac3d36e70fe96e3c9bfc82cd1eeda9ec5b7d3c83c7afe798f9d3de248","kind":"codex_goal","public_key_hex":"aa23c44dc2d8401063a278e10d2e50910bf711956726f06fd026a25c8deb9be9"},"expires_at":"2026-10-18T19:41:19Z","grant_id":"3683172386f1982107d98cdd9eff2366c95485fd10136ccb4cf4fc9d5b43d6bb","grantor":{"actor_id":"96778fbb-c8ff-42b3-9217-7cac45dcd097","provider":"linear","role":"repository_owner"},"issued_at":"2026-09-18T19:41:19Z","scope":{"milestone":"v0.5","permitted_actions":["materialize_task_work_order","request_owner_normal_merge"],"prohibited_actions":["owner_emergency_repair","publication","release_decision","repository_settings","subdelegation"],"project_id":"cf53f98f-0965-4360-a66e-530457e40354","repository":"Miko997/metriplane","task_ids":["MP2-020","MP2-021","MP2-022","MP2-023","MP2-024","MP2-025","MP2-026","MP2-027","MP2-028","MP2-029","MP2-030","MP2-031","MP2-040","MP2-041","MP2-042","MP2-043","MP2-044","MP2-045","MP2-046","MP2-047","MP2-048"]},"signing_key_id":"55a7ba6d677cc402c3b39a9fe59072d50beedfcaa42084a77d2f80d586675666"},"subject_digest":"620ee5e7ca79702bc5b1b9a167dc5bf680f8fd361081747362eb552e956e3ffe","synthetic":false}